{
  "application_ledger": [
    {
      "applied_at": "2026-08-31T15:13:11Z",
      "attempt_id": "attempt:04141ef1-e988-4950-8c27-10937ba021ef",
      "result_digest": "087f79a09e42e4e7cd21ffaf29007e261481b8e8dce584f679ad2a6093279921",
      "task_id": "source:padlet-ashby:luna:832b68b095b9e8e2",
      "transaction_id": "txn:087f79a09e42e4e7cd21ffaf"
    }
  ],
  "company_id": "padlet",
  "current_job_count": 18,
  "fetch_complete": true,
  "jobs": [],
  "last_attempt_at": "2026-08-31T15:12:56Z",
  "last_successful_scan_at": "2026-08-31T15:12:56Z",
  "profile_digest": "13239781e5eab477660f4adc47b83d7ba87903c7a77236fc2d506c220aa2b4f2",
  "profile_id": "ai-product-frontend-v1",
  "provider": "ashby",
  "rejection_counts": {
    "compensation_below_profile_threshold": 2,
    "compensation_unknown_or_below_threshold": 3,
    "location_outside_target_city": 10,
    "title_explicitly_non_target_function": 8,
    "total": 18,
    "workplace_remote_excluded": 3
  },
  "revision": 1,
  "schema_version": 1,
  "source_id": "padlet-ashby",
  "source_revision": 1,
  "unresolved_candidates": [],
  "warnings": []
}
