{
  "application_ledger": [
    {
      "applied_at": "2026-08-31T03:31:54Z",
      "attempt_id": "attempt:9cca68f7-700b-42d0-99e7-214a069ae5b5",
      "result_digest": "7d74e4cf826af997be8ca619c454028d894183bc01b78ff0c05243a9bef194bd",
      "task_id": "source:browserbase-primary:luna:fc1126b5576304f9",
      "transaction_id": "txn:7d74e4cf826af997be8ca619"
    }
  ],
  "company_id": "browserbase",
  "current_job_count": 8,
  "fetch_complete": true,
  "jobs": [],
  "last_attempt_at": "2026-08-31T03:31:39Z",
  "last_successful_scan_at": "2026-08-31T03:31:39Z",
  "profile_digest": "13239781e5eab477660f4adc47b83d7ba87903c7a77236fc2d506c220aa2b4f2",
  "profile_id": "ai-product-frontend-v1",
  "provider": "ashby",
  "rejection_counts": {
    "compensation_below_profile_threshold": 1,
    "compensation_below_threshold_or_unknown": 4,
    "location_outside_target_city": 1,
    "role_fit_not_product_engineering": 4,
    "title_explicitly_non_target_function": 3,
    "total": 13
  },
  "revision": 1,
  "schema_version": 1,
  "source_id": "browserbase-primary",
  "source_revision": 1,
  "unresolved_candidates": [],
  "warnings": []
}
